tangram,utterance,gameId,trialNum,repNum,value,grouping
E,sitting down facing right with head down and 2 triangles on their head,PF2Wo9cXvN4eYEgQm,48,4,0.7228662320106779,"(0.651,0.825]"
I,"balancing on one leg, leg out",XJWjbBteCLNDAtjaR,59,4,0.8126375676346249,"(0.651,0.825]"
I,looks like someone figure skating or ice skating facing the left with their leg sticking out on the right,AdiA5JEZBKJ4F5r4i,22,1,0.723314500047651,"(0.651,0.825]"
L,crouching,cCSd3v7a6AH8fHsJE,58,4,0.671891389395259,"(0.651,0.825]"
F,"The body is in a slumped position Head on the right side and feet pointing to the left, The head is tipped slightly forward, Only lying down person I can see, ie sat down, The legs point left with the legs bent and the knee pointing up, The foot points up to the top left",jqbckBkDqPTfmnAmt,2,0,0.7447343282003928,"(0.651,0.825]"
F,sitting with leg to the left,FEPXqBHpf4Q5CfCju,63,5,0.7972102672099062,"(0.651,0.825]"
E,rabbit ears,htub6itv8siAtQv22,27,2,0.918646404151432,"(0.825,0.949]"
A,dinosaur carrying square on shoulder,G74GhYGrsaxrsfYxf,44,3,0.8991674387477872,"(0.825,0.949]"
F,"this one looks like a man sitting down, leg to the left, looks sad and sulking lol, just sat there bored, no arms",rHhNxKwZ5tqhMuiAF,5,0,0.8710785793426242,"(0.825,0.949]"
F,person sitting down facing left,3NRHD2hCEgJ74Q4b2,52,4,0.8547826735561083,"(0.825,0.949]"
F,man seated,cCSd3v7a6AH8fHsJE,62,5,0.925741594214272,"(0.825,0.949]"
C,"flying angel, outstretched arms, going to the left",6cWDb4KB2JkQYoEn8,26,2,0.8748222176535713,"(0.825,0.949]"
I,the ice skater,vb35TJcSHPpKxAzJo,53,4,0.8861407228478073,"(0.825,0.949]"
A,"dancing birdman, facing left, big triangle for a head, square balanced over right shoulder with one leg up, NA",LfuChcnEB54q8Ztys,30,2,0.9440210774285296,"(0.825,0.949]"
F,person sitting on their bottom,d3pirdbXLaHdgxR9t,0,0,0.9427751879812474,"(0.825,0.949]"
E,bunny,f69G9D9Q2uiv2MCJn,23,1,0.9894266554309686,"(0.949,1]"
I,figure skater,2928FF7GcrkeFiDkh,65,5,0.9954678494312792,"(0.949,1]"
D,robe man with book,CNET4E5tvYW37ZevE,43,3,0.9924539340258284,"(0.949,1]"
C,"both arms up in the air, diamond head, slanted body, leaning to the left, no legs",93ZvRh5AYPNeTJxjv,7,0,0.9790170403843104,"(0.949,1]"
F,"A person who looks depressed, sitting down with their knees bent at a 45 degree angle, their head is tilted downwards, they are facing to the left",ASJgHR2N8wCgN32cu,13,1,0.9606392107460988,"(0.949,1]"
C,"person with both arms up, slightly falling to the left",HQCyESfw7Bwg5LM3Q,9,0,0.9916084495200932,"(0.949,1]"
I,ice-skater,LWXs28TdQJxaEcPzm,71,5,0.9827243682611336,"(0.949,1]"
C,"flying ghost, no legs, two arms in the air",GpF4Ge9YCd7ih3DFr,39,3,0.9966250467644628,"(0.949,1]"
E,bunny ears,22dyGMRgestp8u5Lc,54,4,0.9969089261092072,"(0.949,1]"
F,"slumped man, facing left, knees up, toes up",qvcePeQSJ7k2HTcJt,62,5,0.9720576544445688,"(0.949,1]"
